{
  "schema_version": 1,
  "task_id": "categories-candidate-completion-20261019",
  "owner": "dongyaotalk",
  "branch": "translate/categories/remaining/openai-gpt-6-1-sol",
  "source_commit": "a04446e57ec1fbc252a871afcec7752fb2807b14",
  "allowed_write_files": [
    "task-scopes/categories-candidate-completion-20261019.json",
    "translation-data/chapter-templates/categories.json",
    "docs/categories-candidate-completion.md",
    "docs/evidence/categories-completion-source.json",
    "docs/codex-categories-completion-prompt.md",
    "translation-data/units/categories-remaining-001L-prose_block-4.jsonl",
    "translation-data/candidates/openai-gpt-6.1-sol/categories-remaining-001L-prose_block-4.jsonl",
    "translation-data/units/categories-remaining-001L-prose_block-5.jsonl",
    "translation-data/candidates/openai-gpt-6.1-sol/categories-remaining-001L-prose_block-5.jsonl",
    "translation-data/units/categories-remaining-001R-prose_block-1.jsonl",
    "translation-data/candidates/openai-gpt-6.1-sol/categories-remaining-001R-prose_block-1.jsonl",
    "translation-data/units/categories-remaining-04AO.jsonl",
    "translation-data/candidates/openai-gpt-6.1-sol/categories-remaining-04AO.jsonl",
    "translation-data/units/categories-remaining-04AN-prose_block-1.jsonl",
    "translation-data/candidates/openai-gpt-6.1-sol/categories-remaining-04AN-prose_block-1.jsonl",
    "translation-data/units/categories-remaining-04AP.jsonl",
    "translation-data/candidates/openai-gpt-6.1-sol/categories-remaining-04AP.jsonl",
    "translation-data/units/categories-remaining-04AN-prose_block-2.jsonl",
    "translation-data/candidates/openai-gpt-6.1-sol/categories-remaining-04AN-prose_block-2.jsonl",
    "translation-data/units/categories-remaining-001U-prose_block-1.jsonl",
    "translation-data/candidates/openai-gpt-6.1-sol/categories-remaining-001U-prose_block-1.jsonl",
    "translation-data/units/categories-remaining-08N0.jsonl",
    "translation-data/candidates/openai-gpt-6.1-sol/categories-remaining-08N0.jsonl",
    "translation-data/units/categories-remaining-0021-prose_block-1.jsonl",
    "translation-data/candidates/openai-gpt-6.1-sol/categories-remaining-0021-prose_block-1.jsonl",
    "translation-data/units/categories-remaining-0021-prose_block-2.jsonl",
    "translation-data/candidates/openai-gpt-6.1-sol/categories-remaining-0021-prose_block-2.jsonl",
    "translation-data/units/categories-remaining-03KC.jsonl",
    "translation-data/candidates/openai-gpt-6.1-sol/categories-remaining-03KC.jsonl",
    "translation-data/units/categories-remaining-0025-prose_block-1.jsonl",
    "translation-data/candidates/openai-gpt-6.1-sol/categories-remaining-0025-prose_block-1.jsonl",
    "translation-data/units/categories-remaining-0025-prose_block-2.jsonl",
    "translation-data/candidates/openai-gpt-6.1-sol/categories-remaining-0025-prose_block-2.jsonl",
    "translation-data/units/categories-remaining-08N1.jsonl",
    "translation-data/candidates/openai-gpt-6.1-sol/categories-remaining-08N1.jsonl",
    "translation-data/units/categories-remaining-08LR.jsonl",
    "translation-data/candidates/openai-gpt-6.1-sol/categories-remaining-08LR.jsonl",
    "translation-data/units/categories-remaining-0G2U.jsonl",
    "translation-data/candidates/openai-gpt-6.1-sol/categories-remaining-0G2U.jsonl",
    "translation-data/units/categories-remaining-002D-prose_block-4.jsonl",
    "translation-data/candidates/openai-gpt-6.1-sol/categories-remaining-002D-prose_block-4.jsonl",
    "translation-data/units/categories-remaining-05PT-prose_block-3.jsonl",
    "translation-data/candidates/openai-gpt-6.1-sol/categories-remaining-05PT-prose_block-3.jsonl",
    "translation-data/units/categories-remaining-0GMN.jsonl",
    "translation-data/candidates/openai-gpt-6.1-sol/categories-remaining-0GMN.jsonl",
    "translation-data/units/categories-remaining-0A8B.jsonl",
    "translation-data/candidates/openai-gpt-6.1-sol/categories-remaining-0A8B.jsonl",
    "translation-data/units/categories-remaining-0FWV.jsonl",
    "translation-data/candidates/openai-gpt-6.1-sol/categories-remaining-0FWV.jsonl",
    "translation-data/units/categories-remaining-07RB.jsonl",
    "translation-data/candidates/openai-gpt-6.1-sol/categories-remaining-07RB.jsonl",
    "translation-data/units/categories-remaining-0B65.jsonl",
    "translation-data/candidates/openai-gpt-6.1-sol/categories-remaining-0B65.jsonl",
    "translation-data/units/categories-remaining-0DV0.jsonl",
    "translation-data/candidates/openai-gpt-6.1-sol/categories-remaining-0DV0.jsonl",
    "translation-data/units/categories-remaining-0FWW-prose_block-2.jsonl",
    "translation-data/candidates/openai-gpt-6.1-sol/categories-remaining-0FWW-prose_block-2.jsonl",
    "translation-data/units/categories-remaining-04VB.jsonl",
    "translation-data/candidates/openai-gpt-6.1-sol/categories-remaining-04VB.jsonl",
    "translation-data/units/categories-remaining-04VB-prose_block-1.jsonl",
    "translation-data/candidates/openai-gpt-6.1-sol/categories-remaining-04VB-prose_block-1.jsonl",
    "translation-data/units/categories-remaining-04VC.jsonl",
    "translation-data/candidates/openai-gpt-6.1-sol/categories-remaining-04VC.jsonl",
    "translation-data/units/categories-remaining-04VB-prose_block-2.jsonl",
    "translation-data/candidates/openai-gpt-6.1-sol/categories-remaining-04VB-prose_block-2.jsonl",
    "translation-data/units/categories-remaining-04VD.jsonl",
    "translation-data/candidates/openai-gpt-6.1-sol/categories-remaining-04VD.jsonl",
    "translation-data/units/categories-remaining-0BM1.jsonl",
    "translation-data/candidates/openai-gpt-6.1-sol/categories-remaining-0BM1.jsonl",
    "translation-data/units/categories-remaining-0BM2.jsonl",
    "translation-data/candidates/openai-gpt-6.1-sol/categories-remaining-0BM2.jsonl",
    "translation-data/units/categories-remaining-04VB-prose_block-3.jsonl",
    "translation-data/candidates/openai-gpt-6.1-sol/categories-remaining-04VB-prose_block-3.jsonl",
    "translation-data/units/categories-remaining-04VE.jsonl",
    "translation-data/candidates/openai-gpt-6.1-sol/categories-remaining-04VE.jsonl",
    "translation-data/units/categories-remaining-04VB-prose_block-4.jsonl",
    "translation-data/candidates/openai-gpt-6.1-sol/categories-remaining-04VB-prose_block-4.jsonl",
    "translation-data/units/categories-remaining-04VF.jsonl",
    "translation-data/candidates/openai-gpt-6.1-sol/categories-remaining-04VF.jsonl",
    "translation-data/units/categories-remaining-05Q0.jsonl",
    "translation-data/candidates/openai-gpt-6.1-sol/categories-remaining-05Q0.jsonl",
    "translation-data/units/categories-remaining-04VG.jsonl",
    "translation-data/candidates/openai-gpt-6.1-sol/categories-remaining-04VG.jsonl",
    "translation-data/units/categories-remaining-05Q2.jsonl",
    "translation-data/candidates/openai-gpt-6.1-sol/categories-remaining-05Q2.jsonl",
    "translation-data/units/categories-remaining-05Q3.jsonl",
    "translation-data/candidates/openai-gpt-6.1-sol/categories-remaining-05Q3.jsonl",
    "translation-data/units/categories-remaining-04VB-prose_block-5.jsonl",
    "translation-data/candidates/openai-gpt-6.1-sol/categories-remaining-04VB-prose_block-5.jsonl",
    "translation-data/units/categories-remaining-04VH.jsonl",
    "translation-data/candidates/openai-gpt-6.1-sol/categories-remaining-04VH.jsonl",
    "translation-data/units/categories-remaining-0BM3.jsonl",
    "translation-data/candidates/openai-gpt-6.1-sol/categories-remaining-0BM3.jsonl",
    "translation-data/units/categories-remaining-04VB-prose_block-6.jsonl",
    "translation-data/candidates/openai-gpt-6.1-sol/categories-remaining-04VB-prose_block-6.jsonl",
    "translation-data/units/categories-remaining-04VI.jsonl",
    "translation-data/candidates/openai-gpt-6.1-sol/categories-remaining-04VI.jsonl",
    "translation-data/units/categories-remaining-04VB-prose_block-7.jsonl",
    "translation-data/candidates/openai-gpt-6.1-sol/categories-remaining-04VB-prose_block-7.jsonl",
    "translation-data/units/categories-remaining-04VJ.jsonl",
    "translation-data/candidates/openai-gpt-6.1-sol/categories-remaining-04VJ.jsonl",
    "translation-data/units/categories-remaining-05Q4.jsonl",
    "translation-data/candidates/openai-gpt-6.1-sol/categories-remaining-05Q4.jsonl",
    "translation-data/units/categories-remaining-04VK.jsonl",
    "translation-data/candidates/openai-gpt-6.1-sol/categories-remaining-04VK.jsonl",
    "translation-data/units/categories-remaining-05Q6.jsonl",
    "translation-data/candidates/openai-gpt-6.1-sol/categories-remaining-05Q6.jsonl",
    "translation-data/units/categories-remaining-05Q7.jsonl",
    "translation-data/candidates/openai-gpt-6.1-sol/categories-remaining-05Q7.jsonl",
    "translation-data/units/categories-remaining-04VB-prose_block-8.jsonl",
    "translation-data/candidates/openai-gpt-6.1-sol/categories-remaining-04VB-prose_block-8.jsonl",
    "translation-data/units/categories-remaining-04VL.jsonl",
    "translation-data/candidates/openai-gpt-6.1-sol/categories-remaining-04VL.jsonl",
    "translation-data/units/categories-remaining-05Q8.jsonl",
    "translation-data/candidates/openai-gpt-6.1-sol/categories-remaining-05Q8.jsonl",
    "translation-data/units/categories-remaining-04VB-prose_block-9.jsonl",
    "translation-data/candidates/openai-gpt-6.1-sol/categories-remaining-04VB-prose_block-9.jsonl",
    "translation-data/units/categories-remaining-003D-prose_block-2.jsonl",
    "translation-data/candidates/openai-gpt-6.1-sol/categories-remaining-003D-prose_block-2.jsonl",
    "translation-data/units/categories-remaining-003F.jsonl",
    "translation-data/candidates/openai-gpt-6.1-sol/categories-remaining-003F.jsonl",
    "translation-data/units/categories-remaining-003D-prose_block-3.jsonl",
    "translation-data/candidates/openai-gpt-6.1-sol/categories-remaining-003D-prose_block-3.jsonl",